{
  "admitted_pair_count_after_recovery": 100,
  "append_count": 100,
  "authority_boundary": "synthetic outbox proof grants no execution, disclosure, authorization, or delivery authority",
  "authorized_pair_count_after_recovery": 100,
  "duplicate_count": 0,
  "exact_local_replay": "duplicate-no-op",
  "failed_delivery_code": "sync-storage-unsafe",
  "hub_pair_count_after_recovery": 100,
  "local_pair_count_before_recovery": 100,
  "loss_count": 0,
  "outcome": "passed",
  "receipt_id": "coordination-outbox-conformance-receipt://sha-256/600a79081d22828383848eb11162f6f1e4135e0fe08ca95f68588494d8a5db29",
  "schema_id": "artifact-memory/coordination-outbox-conformance-receipt/v0",
  "unchanged_sync_retry": "byte-identical-no-op"
}
